{
  "schema_version": 1,
  "run_id": "run-20260822T003014Z-76a48308",
  "mode": "continuous",
  "status": "budget_reached",
  "started_at": "2026-08-22T00:30:14+00:00",
  "updated_at": "2026-08-22T01:57:43+00:00",
  "max_rounds": 3,
  "max_hours": null,
  "rounds_completed": 3,
  "current_round": null,
  "confirmations": {},
  "finish_reason": "用户同意的 3 轮预算已用完。本次运行专测 Stack Overflow(用户注册后在自己的 Chrome 里打开),三轮共提取 38 个方向、0 个存活:2 次 G1 全部 pass 但 G3 均 veto,无一条判出 veto_window_bet,故无 fast_grab_ready;账本无 formation_confirmed/qualified 存量且 7 天跨度闸未满(最早 2026-08-27),故无 build_ready/pilot_ready。Semrush 一次未用,额度未耗尽。SO 搜索端点全程被 /nocaptcha 人机验证拦住,按契约未过验证、未改用 API,改走 Bountied 与 Highly-scored-unanswered 两个非搜索端点,不构成 blocker。产出:归并陷阱类别九「零回答与悬赏问题」(证明零回答是提问者孤立的证据而非答案缺失的证据,并给出量化上限——全站最高分未回答问题的浏览量累积多年也只有 1k–9k);新增全集维护者的第四个变体「登录墙后的官方文档被培训行业与转载站补位」(Workday 一例);以及一条零成本批的执行纪律「先核对对象的真实年龄,别采信来源的新标记」(三次独立踩坑为证)。validate_ledger 0 错误 0 警告。",
  "finished_at": "2026-08-22T01:57:43+00:00"
}
