{
  "schema_version": 1,
  "run_id": "run-20260823T000938Z-9080d1d8",
  "mode": "continuous",
  "status": "budget_reached",
  "started_at": "2026-08-23T00:09:38+00:00",
  "updated_at": "2026-08-23T10:36:53+00:00",
  "max_rounds": 5,
  "max_hours": null,
  "rounds_completed": 5,
  "current_round": null,
  "confirmations": {},
  "finish_reason": "用户同意的 5 轮预算已用完。本次运行是 2026-08-23 闸门修订后的首次实跑,目的是记录命中率并用真实结果修订判据,两件都做到了,代价是三次推翻自己。命中率报了三次并逐次下修:75%(第 1 轮,在当日上午自己新增的「小站/混合 → pass」规则下)→ 27%(第 2 轮,该规则被 TSR 一例推翻后回退重算)→ 9%(第 3 轮,发现工具计数只用问句式措辞会系统性漏计后重算)。第 1 轮登记的 3 条候选(EPR、GPSR、CRA)最终全部被自己否掉。11 条义务里最终只有 eu-machinery-regulation-risk-category 存活,它是唯一经三族措辞检验均为 0 个真工具、且经第 5 轮新增的「经营信号」判据仍然放行的方向,已在追踪中、首份 -track 观察已落、7 天跨度自 2026-08-23 起算(最早 08-30 可达形成确认)。契约本轮共改五处:深审入口预检落地生效(4 条义务全过,对照旧账本 75% 过不了)、G3 第一问加两族措辞硬要求、G3 第二问回退关闭、G3 新增「经营信号优先于工具计数」、G6 加「付费者子集比例」与「写清赌注」两条硬要求并录入实测价格锚。Semrush 全程 0 次,额度未耗尽。validate_ledger 0 错误 0 警告。",
  "finished_at": "2026-08-23T10:36:53+00:00"
}
