{
  "schema_version": 1,
  "run_id": "run-20260822T151847Z-d93a5d96",
  "mode": "continuous",
  "status": "budget_reached",
  "started_at": "2026-08-22T15:18:47+00:00",
  "updated_at": "2026-08-22T17:37:59+00:00",
  "max_rounds": 2,
  "max_hours": null,
  "rounds_completed": 2,
  "current_round": null,
  "confirmations": {},
  "finish_reason": "用户同意的 2 轮校准预算已用完。本次运行两轮均为闸门校准测试而非扫描轮,funnel 五项全 0,未注册任何候选、未写任何淘汰索引(理由:用一道正在被证明有校准问题的闸门写永久否决会把错误固化)。产出全部在 xinci-workflow/xinci-core/闸门校准.md 第三、四节:①正向选择器复现 2/2(PPWR 的 ppwrcopilot/ppwrconnect、DPP 的 passportcraft),证明它能准确定位建站者确实在建的地方,但它识别的是已验证市场而非空位;②推翻我自己第三轮刚写的「生效前 12–24 个月是入场窗口」——家具 DPP 授权法案 2028 才定稿却已占满,Tributech 早在 2024-12 就在写,说明位置在任务出现之前就被占;③由此得出唯一可行玩法是「在已被占的查询上做出占位者没做的那个工具」,与第一节从误杀案例反推的 G3 修订从正反两侧独立吻合;④给出 G1/G2/G3 角色重排建议。Semrush 一次未用。validate_ledger 0 错误 0 警告。",
  "finished_at": "2026-08-22T17:37:59+00:00"
}
