{
  "schema_version": 1,
  "run_id": "run-20260821T024756Z-a2592003",
  "mode": "continuous",
  "status": "budget_reached",
  "started_at": "2026-08-21T02:47:56+00:00",
  "updated_at": "2026-08-21T04:52:44+00:00",
  "max_rounds": 10,
  "max_hours": null,
  "rounds_completed": 10,
  "current_round": null,
  "confirmations": {},
  "finish_reason": "用户启动时给的 max_rounds=10 已用完,第 10 轮已 record-round 收尾。本次运行未产出任何 go 决策:无 build_ready/pilot_ready(账本内无 formation_confirmed 或 qualified 存量,且 tracking→formation_confirmed 的 7 天跨度闸使单次运行做不出新的),无 fast_grab_ready(十轮共 3 次完整深审、11 次验证型类别的 G3 验证,全部判 veto,无一条判出 veto_window_bet)。Semrush 网页版全程一次未用,额度未耗尽,不构成终止 B。个别来源被拦(Reddit、Steam、SteamDB、LegiScan、Stack Overflow、即刻、六个标准机构列表页)已逐轮如实记录并换源,不构成 blocker。收尾前已修复一处由本次运行造成的证据覆盖问题(复用同日文件名覆盖了 24 份观察),用 git 原件与本次会话原文并集恢复,validate_ledger 现为 0 错误 0 警告。",
  "finished_at": "2026-08-21T04:52:44+00:00"
}
